{"budget_amendment":{"path":"OC3_NETWORK_REQUEST_BUDGET_AMENDMENT_001.md","sha256":"b1a37ce6fe14399179619a122378df6628218fed7b5d895e08eb7cb7bb574361"},"candidate_state":"PENDING_HUMAN_REVIEW","candidate_type":"AUXILIARY_14_ACQUISITION_AUTHORIZATION_CANDIDATE","canonicalization":"CANONICAL_JSON_SORTED_KEYS_COMPACT_UTF8_LF_V1","command_argv":["/home/jzsalinas/Documents/galaxy-morphology-discovery/oc3/.venv/bin/python","/home/jzsalinas/Documents/galaxy-morphology-discovery/oc3/oc3_resource_contract.py","--acquire-auxiliary","--execute-network","--project","/home/jzsalinas/Documents/galaxy-morphology-discovery","--contract-manifest","/home/jzsalinas/Documents/galaxy-morphology-discovery/oc3/resource_contract/OC3-RESOURCE-CONTRACT-PROBE-002/RESOURCE_CONTRACT_RESOLVED.json","--candidate","/home/jzsalinas/Documents/galaxy-morphology-discovery/oc3/INPUTS/OC3_AUXILIARY_14_ACQUISITION_CANDIDATE_001.json","--authorization","/home/jzsalinas/Documents/galaxy-morphology-discovery/oc3/INPUTS/OC3_AUXILIARY_ACQUISITION_AUTHORIZATION_001.json","--audit-directory","/home/jzsalinas/Documents/galaxy-morphology-discovery/oc3/auxiliary_acquisition/OC3-RESOURCE-CONTRACT-AUXILIARY-ACQUISITION-001","--log","/home/jzsalinas/Documents/galaxy-morphology-discovery/oc3/auxiliary_acquisition/OC3-RESOURCE-CONTRACT-AUXILIARY-ACQUISITION-001/AUXILIARY_RUN.log","--stage-request-cap","34","--stage-retry-request-pool","6","--expected-body-bytes","3827520"],"expected_body_bytes":3827520,"final_authorization_path":"/home/jzsalinas/Documents/galaxy-morphology-discovery/oc3/INPUTS/OC3_AUXILIARY_ACQUISITION_AUTHORIZATION_001.json","global_caps":{"body_bytes":1610612736,"concurrency":1,"historical_request_planning_estimate":200},"implementation_aggregate":"1ca462cff61ea09f93ac23210e1966bbb7e3be37f231b92901f60b65f89d1ec0","negative_capabilities":{"alternate_url":false,"automatic_resume":false,"image_invvar_acquisition":false,"location_selection":false,"provider_reprobe":false,"science_pixel_interpretation":false},"primary_requests":{"get":14,"head":14,"total":28},"resolved_contract":{"path":"oc3/resource_contract/OC3-RESOURCE-CONTRACT-PROBE-002/RESOURCE_CONTRACT_RESOLVED.json","sha256":"5afff8fddbcb8a9e86ea3f55cf89288840a21ca705bca121ed1b9204c349616d"},"resource_count":14,"resources":[{"band":"g","content_encoding":"identity","expected_content_length":161280,"expected_etag":"\"27600-5b8b09085dc80\"","literal_url":"https://portal.nersc.gov/cfs/cosmo/data/legacysurvey/dr9/south/coadd/344/3443m052/legacysurvey-3443m052-nexp-g.fits.fz","product":"nexp","region":"south","resource_id":"oc3_a1c91b759ee0c92134b345dd"},{"band":"r","content_encoding":"identity","expected_content_length":141120,"expected_etag":"\"22740-5b8b09085dc80\"","literal_url":"https://portal.nersc.gov/cfs/cosmo/data/legacysurvey/dr9/south/coadd/344/3443m052/legacysurvey-3443m052-nexp-r.fits.fz","product":"nexp","region":"south","resource_id":"oc3_af43131868fe38641670dfff"},{"band":"z","content_encoding":"identity","expected_content_length":161280,"expected_etag":"\"27600-5b8b090769a40\"","literal_url":"https://portal.nersc.gov/cfs/cosmo/data/legacysurvey/dr9/south/coadd/344/3443m052/legacysurvey-3443m052-nexp-z.fits.fz","product":"nexp","region":"south","resource_id":"oc3_129068557b1450fb5ba37206"},{"band":"g","content_encoding":"identity","expected_content_length":374400,"expected_etag":"\"5b680-5b8b090769a40\"","literal_url":"https://portal.nersc.gov/cfs/cosmo/data/legacysurvey/dr9/south/coadd/344/3443m052/legacysurvey-3443m052-psfsize-g.fits.fz","product":"psfsize","region":"south","resource_id":"oc3_1fe01517651f979b4b35049e"},{"band":"r","content_encoding":"identity","expected_content_length":374400,"expected_etag":"\"5b680-5b8b09085dc80\"","literal_url":"https://portal.nersc.gov/cfs/cosmo/data/legacysurvey/dr9/south/coadd/344/3443m052/legacysurvey-3443m052-psfsize-r.fits.fz","product":"psfsize","region":"south","resource_id":"oc3_0ec691a4a408766d0e82fdf2"},{"band":"z","content_encoding":"identity","expected_content_length":385920,"expected_etag":"\"5e380-5b8b090769a40\"","literal_url":"https://portal.nersc.gov/cfs/cosmo/data/legacysurvey/dr9/south/coadd/344/3443m052/legacysurvey-3443m052-psfsize-z.fits.fz","product":"psfsize","region":"south","resource_id":"oc3_92cbadc5b206cc6392947f21"},{"band":null,"content_encoding":"identity","expected_content_length":233280,"expected_etag":"\"38f40-5b8b090769a40\"","literal_url":"https://portal.nersc.gov/cfs/cosmo/data/legacysurvey/dr9/south/coadd/344/3443m052/legacysurvey-3443m052-maskbits.fits.fz","product":"maskbits","region":"south","resource_id":"oc3_e74c49b3b7d7e66a77d7ea73"},{"band":"g","content_encoding":"identity","expected_content_length":106560,"expected_etag":"\"1a040-5ac9f8e326c40\"","literal_url":"https://portal.nersc.gov/cfs/cosmo/data/legacysurvey/dr9/north/coadd/247/2478p325/legacysurvey-2478p325-nexp-g.fits.fz","product":"nexp","region":"north","resource_id":"oc3_be55f6be3f5d0eb340dbd638"},{"band":"r","content_encoding":"identity","expected_content_length":97920,"expected_etag":"\"17e80-5ac9f97510480\"","literal_url":"https://portal.nersc.gov/cfs/cosmo/data/legacysurvey/dr9/north/coadd/247/2478p325/legacysurvey-2478p325-nexp-r.fits.fz","product":"nexp","region":"north","resource_id":"oc3_179cc297dddaee76b85ef6f8"},{"band":"z","content_encoding":"identity","expected_content_length":181440,"expected_etag":"\"2c4c0-5ac9f9f99fd40\"","literal_url":"https://portal.nersc.gov/cfs/cosmo/data/legacysurvey/dr9/north/coadd/247/2478p325/legacysurvey-2478p325-nexp-z.fits.fz","product":"nexp","region":"north","resource_id":"oc3_6ea12d3dfedb57cb4694e64c"},{"band":"g","content_encoding":"identity","expected_content_length":351360,"expected_etag":"\"55c80-5ac9f8e41ae80\"","literal_url":"https://portal.nersc.gov/cfs/cosmo/data/legacysurvey/dr9/north/coadd/247/2478p325/legacysurvey-2478p325-psfsize-g.fits.fz","product":"psfsize","region":"north","resource_id":"oc3_d35bb2a6ae443de63c3fb3b4"},{"band":"r","content_encoding":"identity","expected_content_length":351360,"expected_etag":"\"55c80-5ac9f976046c0\"","literal_url":"https://portal.nersc.gov/cfs/cosmo/data/legacysurvey/dr9/north/coadd/247/2478p325/legacysurvey-2478p325-psfsize-r.fits.fz","product":"psfsize","region":"north","resource_id":"oc3_6906a01044621a558c9b6cde"},{"band":"z","content_encoding":"identity","expected_content_length":391680,"expected_etag":"\"5fa00-5ac9f9fa93f80\"","literal_url":"https://portal.nersc.gov/cfs/cosmo/data/legacysurvey/dr9/north/coadd/247/2478p325/legacysurvey-2478p325-psfsize-z.fits.fz","product":"psfsize","region":"north","resource_id":"oc3_331684f0c7ab9b77c866cbfa"},{"band":null,"content_encoding":"identity","expected_content_length":515520,"expected_etag":"\"7ddc0-5ac9fca28c3c0\"","literal_url":"https://portal.nersc.gov/cfs/cosmo/data/legacysurvey/dr9/north/coadd/247/2478p325/legacysurvey-2478p325-maskbits.fits.fz","product":"maskbits","region":"north","resource_id":"oc3_6bfe8bca2e2c040feb91bcd2"}],"retry_policy":{"additional_per_exact_identity":2,"automatic_resume":false,"automatic_retry":false,"separate_resume_authorization":true,"stage_request_cap":34,"stage_retry_request_pool":6},"schema_version":"OC3_AUXILIARY_14_ACQUISITION_CANDIDATE_001","scope":"AUXILIARY_14_ONLY","sealed":"766a4b014d176373b268c149553c27fa89cabadf3118a7d35c57e80649b3ea69","stage_id":"OC3-RESOURCE-CONTRACT-AUXILIARY-ACQUISITION-001","starting_cumulative":{"body_bytes":89836046,"requests":166}}
